PMID,Title,Authors,Citation,First Author,Journal/Book,Publication Year,Create Date,PMCID,NIHMS ID,DOI
"31358874","From curved spacetime to spacetime-dependent local unitaries over the honeycomb and triangular Quantum Walks","Arrighi P, Di Molfetta G, Marquez-Martin I, Perez A.","Sci Rep. 2019 Jul 29;9(1):10904. doi: 10.1038/s41598-019-47535-4.","Arrighi P","Sci Rep","2019","2019/07/31","PMC6662829","","10.1038/s41598-019-47535-4"
"30932546","Giant Shot Noise from Majorana Zero Modes in Topological Trijunctions","Jonckheere T, Rech J, Zazunov A, Egger R, Yeyati AL, Martin T.","Phys Rev Lett. 2019 Mar 8;122(9):097003. doi: 10.1103/PhysRevLett.122.097003.","Jonckheere T","Phys Rev Lett","2019","2019/04/02","","","10.1103/PhysRevLett.122.097003"
"30706978","Unexpected peaks in electron ionisation mass spectra of trimethylsilyl derivatives resulting from the presence of trace amounts of water and oxygen in gas chromatography/quadrupole time-of-flight systems","Rontani JF, Aubert C.","Rapid Commun Mass Spectrom. 2019 Apr 15;33(7):741-743. doi: 10.1002/rcm.8404.","Rontani JF","Rapid Commun Mass Spectrom","2019","2019/02/02","","","10.1002/rcm.8404"
"33816876","NIPS4Bplus: a richly annotated birdsong audio dataset","Morfi V, Bas Y, Pamuła H, Glotin H, Stowell D.","PeerJ Comput Sci. 2019 Oct 7;5:e223. doi: 10.7717/peerj-cs.223. eCollection 2019.","Morfi V","PeerJ Comput Sci","2019","2021/04/05","PMC7924541","","10.7717/peerj-cs.223"
"31294095","Erratum to ""Characterization and densification of defect pyrochlore oxide powders ABi(2)Ta(5)O(16) (A=Na, Tl)"" [Heliyon 5 (5) (May 2019) e01628]","Sidi Ahmed OA, Bourja L, Chagraoui A, Tairi A, Moussaoui A, Oulahyane HA, Manoun B, Villain S.","Heliyon. 2019 Jun 21;5(6):e01891. doi: 10.1016/j.heliyon.2019.e01891. eCollection 2019 Jun.","Sidi Ahmed OA","Heliyon","2019","2019/07/12","PMC6595170","","10.1016/j.heliyon.2019.e01891"
"30337123","Corrigendum to ""Atmospheric particle-bound organophosphate ester flame retardants and plasticizers in a North African Mediterranean coastal city (Bizerte, Tunisia)"" [Sci. Total Environ. 642 (2018) 383-393]","Castro-Jiménez J, Sempéré R.","Sci Total Environ. 2019 Feb 15;651(Pt 2):3272. doi: 10.1016/j.scitotenv.2018.10.088. Epub 2018 Oct 16.","Castro-Jiménez J","Sci Total Environ","2019","2018/10/20","","","10.1016/j.scitotenv.2018.10.088"
